{
  "schema_version": 1,
  "message_id": "018cc251-f400-7a88-8000-00000000002a",
  "site_id": "workshop-demo",
  "device_id": "motor-01",
  "sequence": 42,
  "device_time": "2026-08-11T08:00:00Z",
  "clock_synchronized": true,
  "uptime_ms": 120000,
  "firmware_version": "0.1.0",
  "quality": "good",
  "replayed": false,
  "measurements": {
    "temperature_c": 42.3,
    "vibration_rms_mps2": 1.21,
    "vibration_peak_mps2": 2.88,
    "vibration_crest_factor": 2.38,
    "current_a": 0.64
  },
  "sample_quality": {
    "temperature": {"status": "good", "valid_samples": 10, "expected_samples": 10, "error_code": null},
    "vibration": {"status": "good", "valid_samples": 256, "expected_samples": 256, "error_code": null},
    "current": {"status": "good", "valid_samples": 50, "expected_samples": 50, "error_code": null}
  },
  "fault_flags": []
}

