{
  "schema_version": 1,
  "message_id": "018cc251-f400-7a88-8000-00000000002b",
  "site_id": "workshop-demo",
  "device_id": "motor-01",
  "sequence": 43,
  "device_time": "2026-08-11T08:00:10Z",
  "clock_synchronized": true,
  "uptime_ms": 130000,
  "firmware_version": "0.1.0",
  "quality": "bad",
  "replayed": false,
  "measurements": {
    "temperature_c": null,
    "vibration_rms_mps2": 1.25,
    "vibration_peak_mps2": 3.01,
    "vibration_crest_factor": 2.41,
    "current_a": 0.65
  },
  "sample_quality": {
    "temperature": {"status": "driver_error", "valid_samples": 0, "expected_samples": 10, "error_code": "TMP117_NACK"},
    "vibration": {"status": "good", "valid_samples": 256, "expected_samples": 256, "error_code": null},
    "current": {"status": "good", "valid_samples": 50, "expected_samples": 50, "error_code": null}
  },
  "fault_flags": ["TEMPERATURE_SENSOR_FAILURE"]
}

